[
  {"id":"dtx-001","clientId":"demo","dealId":"deal-001","txDate":"2024-01-15T00:00:00Z","txType":"buy","amount":2500000,"currency":"USD","units":250000,"pricePerUnit":10,"counterparty":"Horizon Ventures","status":"posted","glRefId":"gl-101","createdAt":"2024-01-15T10:00:00Z","updatedAt":"2024-01-16T10:00:00Z"},
  {"id":"dtx-002","clientId":"demo","dealId":"deal-001","txDate":"2024-02-01T00:00:00Z","txType":"fee","amount":50000,"currency":"USD","counterparty":"Horizon Ventures","status":"posted","glRefId":"gl-102","createdAt":"2024-02-01T10:00:00Z","updatedAt":"2024-02-02T10:00:00Z"},
  {"id":"dtx-003","clientId":"demo","dealId":"deal-002","txDate":"2024-01-20T00:00:00Z","txType":"buy","amount":6000000,"currency":"EUR","counterparty":"Nordic Properties","status":"posted","glRefId":"gl-103","createdAt":"2024-01-20T10:00:00Z","updatedAt":"2024-01-21T10:00:00Z"},
  {"id":"dtx-004","clientId":"demo","dealId":"deal-004","txDate":"2024-01-10T00:00:00Z","txType":"buy","amount":3000000,"currency":"USD","counterparty":"GreenCo Finance","status":"posted","glRefId":"gl-104","createdAt":"2024-01-10T10:00:00Z","updatedAt":"2024-01-11T10:00:00Z"},
  {"id":"dtx-005","clientId":"demo","dealId":"deal-004","txDate":"2024-02-01T00:00:00Z","txType":"dividend","amount":45000,"currency":"USD","counterparty":"GreenCo Finance","status":"posted","glRefId":"gl-105","createdAt":"2024-02-01T10:00:00Z","updatedAt":"2024-02-02T10:00:00Z"},
  {"id":"dtx-006","clientId":"demo","dealId":"deal-007","txDate":"2024-02-10T00:00:00Z","txType":"buy","amount":4500000,"currency":"USD","units":45000,"pricePerUnit":100,"counterparty":"Goldman Sachs","status":"posted","glRefId":"gl-106","createdAt":"2024-02-10T10:00:00Z","updatedAt":"2024-02-11T10:00:00Z"},
  {"id":"dtx-007","clientId":"demo","dealId":"deal-008","txDate":"2023-11-15T00:00:00Z","txType":"buy","amount":6000000,"currency":"EUR","counterparty":"EU Growth Partners","status":"posted","glRefId":"gl-107","createdAt":"2023-11-15T10:00:00Z","updatedAt":"2023-11-16T10:00:00Z"},
  {"id":"dtx-008","clientId":"demo","dealId":"deal-008","txDate":"2024-01-10T00:00:00Z","txType":"distribution","amount":750000,"currency":"EUR","counterparty":"EU Growth Partners","status":"posted","glRefId":"gl-108","createdAt":"2024-01-10T10:00:00Z","updatedAt":"2024-01-11T10:00:00Z"},
  {"id":"dtx-009","clientId":"demo","dealId":"deal-013","txDate":"2023-09-15T00:00:00Z","txType":"buy","amount":5000000,"currency":"USD","counterparty":"Legacy Partners","status":"posted","glRefId":"gl-109","createdAt":"2023-09-15T10:00:00Z","updatedAt":"2023-09-16T10:00:00Z"},
  {"id":"dtx-010","clientId":"demo","dealId":"deal-013","txDate":"2023-12-15T00:00:00Z","txType":"sell","amount":9500000,"currency":"USD","counterparty":"Legacy Partners","status":"posted","glRefId":"gl-110","createdAt":"2023-12-15T10:00:00Z","updatedAt":"2023-12-16T10:00:00Z"},
  {"id":"dtx-011","clientId":"demo","dealId":"deal-012","txDate":"2024-01-25T00:00:00Z","txType":"buy","amount":9000000,"currency":"EUR","counterparty":"GreenPower Ltd","status":"posted","glRefId":"gl-111","createdAt":"2024-01-25T10:00:00Z","updatedAt":"2024-01-26T10:00:00Z"},
  {"id":"dtx-012","clientId":"demo","dealId":"deal-016","txDate":"2024-01-20T00:00:00Z","txType":"buy","amount":5500000,"currency":"USD","counterparty":"DataCo REIT","status":"posted","glRefId":"gl-112","createdAt":"2024-01-20T10:00:00Z","updatedAt":"2024-01-21T10:00:00Z"},
  {"id":"dtx-013","clientId":"demo","dealId":"deal-016","txDate":"2024-02-15T00:00:00Z","txType":"buy","amount":5500000,"currency":"USD","counterparty":"DataCo REIT","status":"draft","createdAt":"2024-02-15T10:00:00Z","updatedAt":"2024-02-16T10:00:00Z"},
  {"id":"dtx-014","clientId":"demo","dealId":"deal-017","txDate":"2023-08-20T00:00:00Z","txType":"buy","amount":4200000,"currency":"USD","counterparty":"Brand Capital","status":"posted","glRefId":"gl-113","createdAt":"2023-08-20T10:00:00Z","updatedAt":"2023-08-21T10:00:00Z"},
  {"id":"dtx-015","clientId":"demo","dealId":"deal-021","txDate":"2023-12-10T00:00:00Z","txType":"buy","amount":7200000,"currency":"USD","counterparty":"Prologis","status":"posted","glRefId":"gl-114","createdAt":"2023-12-10T10:00:00Z","updatedAt":"2023-12-11T10:00:00Z"},
  {"id":"dtx-016","clientId":"demo","dealId":"deal-001","txDate":"2024-02-20T00:00:00Z","txType":"buy","amount":2500000,"currency":"USD","units":200000,"pricePerUnit":12.5,"counterparty":"Horizon Ventures","status":"draft","createdAt":"2024-02-20T10:00:00Z","updatedAt":"2024-02-21T10:00:00Z"},
  {"id":"dtx-017","clientId":"demo","dealId":"deal-003","txDate":"2024-02-05T00:00:00Z","txType":"fee","amount":80000,"currency":"USD","counterparty":"Apex Partners","status":"pending","createdAt":"2024-02-05T10:00:00Z","updatedAt":"2024-02-06T10:00:00Z"},
  {"id":"dtx-018","clientId":"demo","dealId":"deal-009","txDate":"2024-02-01T00:00:00Z","txType":"buy","amount":3750000,"currency":"USD","counterparty":"MedTech Ventures","status":"posted","glRefId":"gl-115","createdAt":"2024-02-01T10:00:00Z","updatedAt":"2024-02-02T10:00:00Z"},
  {"id":"dtx-019","clientId":"demo","dealId":"deal-015","txDate":"2024-02-10T00:00:00Z","txType":"buy","amount":2750000,"currency":"EUR","counterparty":"LogiCap Partners","status":"posted","glRefId":"gl-116","createdAt":"2024-02-10T10:00:00Z","updatedAt":"2024-02-11T10:00:00Z"},
  {"id":"dtx-020","clientId":"demo","dealId":"deal-020","txDate":"2024-02-01T00:00:00Z","txType":"buy","amount":2000000,"currency":"USD","counterparty":"LifeSci Ventures","status":"posted","glRefId":"gl-117","createdAt":"2024-02-01T10:00:00Z","updatedAt":"2024-02-02T10:00:00Z"},
  {"id":"dtx-021","clientId":"demo","dealId":"deal-002","txDate":"2024-02-15T00:00:00Z","txType":"fee","amount":120000,"currency":"EUR","counterparty":"Nordic Properties","status":"draft","createdAt":"2024-02-15T10:00:00Z","updatedAt":"2024-02-16T10:00:00Z"},
  {"id":"dtx-022","clientId":"demo","dealId":"deal-010","txDate":"2024-02-08T00:00:00Z","txType":"fee","amount":250000,"currency":"JPY","counterparty":"Tokyo RE Holdings","status":"pending","createdAt":"2024-02-08T10:00:00Z","updatedAt":"2024-02-09T10:00:00Z"},
  {"id":"dtx-023","clientId":"demo","dealId":"deal-012","txDate":"2024-02-20T00:00:00Z","txType":"buy","amount":4500000,"currency":"EUR","counterparty":"GreenPower Ltd","status":"draft","createdAt":"2024-02-20T10:00:00Z","updatedAt":"2024-02-21T10:00:00Z"},
  {"id":"dtx-024","clientId":"demo","dealId":"deal-019","txDate":"2024-02-12T00:00:00Z","txType":"fee","amount":85000,"currency":"USD","counterparty":"Credit Partners LP","status":"pending","createdAt":"2024-02-12T10:00:00Z","updatedAt":"2024-02-13T10:00:00Z"},
  {"id":"dtx-025","clientId":"demo","dealId":"deal-020","txDate":"2024-02-18T00:00:00Z","txType":"buy","amount":1000000,"currency":"USD","counterparty":"LifeSci Ventures","status":"draft","createdAt":"2024-02-18T10:00:00Z","updatedAt":"2024-02-19T10:00:00Z"}
]
